"No.","Time","Source","Destination","Protocol","Length","Info"
"11","1.933581","192.168.43.150","27.112.79.120","TCP","66","63761  >  443 [SYN] Seq=0 Win=64240 Len=0 MSS=1460 WS=256 SACK_PERM=1"
"12","1.956534","27.112.79.120","192.168.43.150","TCP","66","443  >  63761 [SYN, ACK] Seq=0 Ack=1 Win=4200 Len=0 MSS=1400 WS=4 SACK_PERM=1"
"13","1.956830","192.168.43.150","27.112.79.120","TCP","54","63761  >  443 [ACK] Seq=1 Ack=1 Win=65792 Len=0"
"14","1.958527","192.168.43.150","27.112.79.120","TLSv1.3","707","Client Hello"
"15","1.987330","27.112.79.120","192.168.43.150","TCP","54","443  >  63761 [ACK] Seq=1 Ack=654 Win=4852 Len=0"
"16","2.033561","27.112.79.120","192.168.43.150","TLSv1.3","294","Server Hello, Change Cipher Spec, Application Data, Application Data"
"17","2.037022","192.168.43.150","27.112.79.120","TLSv1.3","118","Change Cipher Spec, Application Data"
"18","2.039041","192.168.43.150","27.112.79.120","TLSv1.3","670","Application Data"
"19","2.067042","27.112.79.120","192.168.43.150","TCP","54","443  >  63761 [ACK] Seq=241 Ack=718 Win=4916 Len=0"
"20","2.078678","27.112.79.120","192.168.43.150","TCP","54","443  >  63761 [ACK] Seq=241 Ack=1334 Win=5532 Len=0"
"21","2.094747","27.112.79.120","192.168.43.150","TLSv1.3","325","Application Data"
"22","2.145149","192.168.43.150","27.112.79.120","TCP","54","63761  >  443 [ACK] Seq=1334 Ack=512 Win=65280 Len=0"
"23","2.168412","27.112.79.120","192.168.43.150","TLSv1.3","1454","Application Data"
"24","2.180637","27.112.79.120","192.168.43.150","TCP","1454","443  >  63761 [ACK] Seq=1912 Ack=1334 Win=5532 Len=1400 [TCP segment of a reassembled PDU]"
"25","2.181088","192.168.43.150","27.112.79.120","TCP","54","63761  >  443 [ACK] Seq=1334 Ack=3312 Win=65792 Len=0"
"26","2.181367","27.112.79.120","192.168.43.150","TCP","1454","443  >  63761 [PSH, ACK] Seq=3312 Ack=1334 Win=5532 Len=1400 [TCP segment of a reassembled PDU]"
"27","2.198380","27.112.79.120","192.168.43.150","TCP","1454","443  >  63761 [ACK] Seq=4712 Ack=1334 Win=5532 Len=1400 [TCP segment of a reassembled PDU]"
"28","2.198762","192.168.43.150","27.112.79.120","TCP","54","63761  >  443 [ACK] Seq=1334 Ack=6112 Win=65792 Len=0"
"29","2.209463","27.112.79.120","192.168.43.150","TCP","1454","443  >  63761 [PSH, ACK] Seq=6112 Ack=1334 Win=5532 Len=1400 [TCP segment of a reassembled PDU]"
"30","2.209907","27.112.79.120","192.168.43.150","TCP","1454","443  >  63761 [ACK] Seq=7512 Ack=1334 Win=5532 Len=1400 [TCP segment of a reassembled PDU]"
"31","2.210072","192.168.43.150","27.112.79.120","TCP","54","63761  >  443 [ACK] Seq=1334 Ack=8912 Win=65792 Len=0"
"32","2.210473","27.112.79.120","192.168.43.150","TCP","1454","443  >  63761 [ACK] Seq=8912 Ack=1334 Win=5532 Len=1400 [TCP segment of a reassembled PDU]"
"33","2.214203","27.112.79.120","192.168.43.150","TCP","1454","443  >  63761 [PSH, ACK] Seq=10312 Ack=1334 Win=5532 Len=1400 [TCP segment of a reassembled PDU]"
"34","2.214699","192.168.43.150","27.112.79.120","TCP","54","63761  >  443 [ACK] Seq=1334 Ack=11712 Win=65792 Len=0"
"35","2.214950","27.112.79.120","192.168.43.150","TCP","1454","443  >  63761 [PSH, ACK] Seq=11712 Ack=1334 Win=5532 Len=1400 [TCP segment of a reassembled PDU]"
"36","2.225406","27.112.79.120","192.168.43.150","TCP","1454","443  >  63761 [PSH, ACK] Seq=13112 Ack=1334 Win=5532 Len=1400 [TCP segment of a reassembled PDU]"
"37","2.225885","192.168.43.150","27.112.79.120","TCP","54","63761  >  443 [ACK] Seq=1334 Ack=14512 Win=65792 Len=0"
"38","2.236649","27.112.79.120","192.168.43.150","TCP","1454","443  >  63761 [PSH, ACK] Seq=14512 Ack=1334 Win=5532 Len=1400 [TCP segment of a reassembled PDU]"
"39","2.237071","27.112.79.120","192.168.43.150","TLSv1.3","1454","Application Data [TCP segment of a reassembled PDU]"
"40","2.237071","27.112.79.120","192.168.43.150","TCP","1454","443  >  63761 [ACK] Seq=17312 Ack=1334 Win=5532 Len=1400 [TCP segment of a reassembled PDU]"
"41","2.237208","192.168.43.150","27.112.79.120","TCP","54","63761  >  443 [ACK] Seq=1334 Ack=18712 Win=65792 Len=0"
"42","2.237445","27.112.79.120","192.168.43.150","TCP","1454","443  >  63761 [ACK] Seq=18712 Ack=1334 Win=5532 Len=1400 [TCP segment of a reassembled PDU]"
"43","2.237541","192.168.43.150","27.112.79.120","TCP","54","63761  >  443 [ACK] Seq=1334 Ack=20112 Win=65792 Len=0"
"44","2.237672","27.112.79.120","192.168.43.150","TCP","1454","443  >  63761 [PSH, ACK] Seq=20112 Ack=1334 Win=5532 Len=1400 [TCP segment of a reassembled PDU]"
"45","2.250815","27.112.79.120","192.168.43.150","TCP","1454","443  >  63761 [ACK] Seq=21512 Ack=1334 Win=5532 Len=1400 [TCP segment of a reassembled PDU]"
"46","2.251174","192.168.43.150","27.112.79.120","TCP","54","63761  >  443 [ACK] Seq=1334 Ack=22912 Win=65792 Len=0"
"47","2.262512","27.112.79.120","192.168.43.150","TCP","1454","443  >  63761 [ACK] Seq=22912 Ack=1334 Win=5532 Len=1400 [TCP segment of a reassembled PDU]"
"48","2.268262","27.112.79.120","192.168.43.150","TCP","1454","443  >  63761 [PSH, ACK] Seq=24312 Ack=1334 Win=5532 Len=1400 [TCP segment of a reassembled PDU]"
"49","2.268335","192.168.43.150","27.112.79.120","TCP","54","63761  >  443 [ACK] Seq=1334 Ack=25712 Win=65792 Len=0"
"50","2.268629","27.112.79.120","192.168.43.150","TCP","1454","443  >  63761 [PSH, ACK] Seq=25712 Ack=1334 Win=5532 Len=1400 [TCP segment of a reassembled PDU]"
"51","2.268629","27.112.79.120","192.168.43.150","TCP","1454","443  >  63761 [ACK] Seq=27112 Ack=1334 Win=5532 Len=1400 [TCP segment of a reassembled PDU]"
"52","2.268654","192.168.43.150","27.112.79.120","TCP","54","63761  >  443 [ACK] Seq=1334 Ack=28512 Win=65792 Len=0"
"53","2.268865","27.112.79.120","192.168.43.150","TCP","1454","443  >  63761 [PSH, ACK] Seq=28512 Ack=1334 Win=5532 Len=1400 [TCP segment of a reassembled PDU]"
"54","2.269220","27.112.79.120","192.168.43.150","TCP","1454","443  >  63761 [ACK] Seq=29912 Ack=1334 Win=5532 Len=1400 [TCP segment of a reassembled PDU]"
"55","2.269275","192.168.43.150","27.112.79.120","TCP","54","63761  >  443 [ACK] Seq=1334 Ack=31312 Win=65792 Len=0"
"56","2.269454","27.112.79.120","192.168.43.150","TCP","1454","443  >  63761 [PSH, ACK] Seq=31312 Ack=1334 Win=5532 Len=1400 [TCP segment of a reassembled PDU]"
"57","2.278355","27.112.79.120","192.168.43.150","TLSv1.3","1454","Application Data [TCP segment of a reassembled PDU]"
"58","2.278422","192.168.43.150","27.112.79.120","TCP","54","63761  >  443 [ACK] Seq=1334 Ack=34112 Win=65792 Len=0"
"59","2.291035","27.112.79.120","192.168.43.150","TCP","1454","443  >  63761 [ACK] Seq=34112 Ack=1334 Win=5532 Len=1400 [TCP segment of a reassembled PDU]"
"60","2.291035","27.112.79.120","192.168.43.150","TCP","1454","443  >  63761 [PSH, ACK] Seq=35512 Ack=1334 Win=5532 Len=1400 [TCP segment of a reassembled PDU]"
"61","2.291172","192.168.43.150","27.112.79.120","TCP","54","63761  >  443 [ACK] Seq=1334 Ack=36912 Win=65792 Len=0"
"62","2.291263","27.112.79.120","192.168.43.150","TCP","1454","443  >  63761 [ACK] Seq=36912 Ack=1334 Win=5532 Len=1400 [TCP segment of a reassembled PDU]"
"63","2.291263","27.112.79.120","192.168.43.150","TCP","1454","443  >  63761 [PSH, ACK] Seq=38312 Ack=1334 Win=5532 Len=1400 [TCP segment of a reassembled PDU]"
"64","2.291292","192.168.43.150","27.112.79.120","TCP","54","63761  >  443 [ACK] Seq=1334 Ack=39712 Win=65792 Len=0"
"65","2.291326","27.112.79.120","192.168.43.150","TCP","1454","443  >  63761 [ACK] Seq=39712 Ack=1334 Win=5532 Len=1400 [TCP segment of a reassembled PDU]"
"66","2.291353","27.112.79.120","192.168.43.150","TCP","1454","443  >  63761 [ACK] Seq=41112 Ack=1334 Win=5532 Len=1400 [TCP segment of a reassembled PDU]"
"67","2.291366","192.168.43.150","27.112.79.120","TCP","54","63761  >  443 [ACK] Seq=1334 Ack=42512 Win=65792 Len=0"
"68","2.296178","27.112.79.120","192.168.43.150","TCP","1454","443  >  63761 [PSH, ACK] Seq=42512 Ack=1334 Win=5532 Len=1400 [TCP segment of a reassembled PDU]"
"69","2.307552","27.112.79.120","192.168.43.150","TCP","1454","443  >  63761 [PSH, ACK] Seq=43912 Ack=1334 Win=5532 Len=1400 [TCP segment of a reassembled PDU]"
"70","2.307654","192.168.43.150","27.112.79.120","TCP","54","63761  >  443 [ACK] Seq=1334 Ack=45312 Win=65792 Len=0"
"71","2.332180","27.112.79.120","192.168.43.150","TCP","1454","443  >  63761 [ACK] Seq=45312 Ack=1334 Win=5532 Len=1400 [TCP segment of a reassembled PDU]"
"72","2.338309","27.112.79.120","192.168.43.150","TCP","1454","443  >  63761 [ACK] Seq=46712 Ack=1334 Win=5532 Len=1400 [TCP segment of a reassembled PDU]"
"73","2.338391","192.168.43.150","27.112.79.120","TCP","54","63761  >  443 [ACK] Seq=1334 Ack=48112 Win=65792 Len=0"
"74","2.338472","27.112.79.120","192.168.43.150","TCP","1454","443  >  63761 [ACK] Seq=48112 Ack=1334 Win=5532 Len=1400 [TCP segment of a reassembled PDU]"
"75","2.343996","27.112.79.120","192.168.43.150","TLSv1.3","1454","Application Data [TCP segment of a reassembled PDU]"
"76","2.344077","192.168.43.150","27.112.79.120","TCP","54","63761  >  443 [ACK] Seq=1334 Ack=50912 Win=65792 Len=0"
"77","2.372400","27.112.79.120","192.168.43.150","TCP","1454","443  >  63761 [ACK] Seq=50912 Ack=1334 Win=5532 Len=1400 [TCP segment of a reassembled PDU]"
"78","2.378400","27.112.79.120","192.168.43.150","TCP","1454","443  >  63761 [PSH, ACK] Seq=52312 Ack=1334 Win=5532 Len=1400 [TCP segment of a reassembled PDU]"
"79","2.378400","27.112.79.120","192.168.43.150","TCP","1454","443  >  63761 [ACK] Seq=53712 Ack=1334 Win=5532 Len=1400 [TCP segment of a reassembled PDU]"
"80","2.378511","192.168.43.150","27.112.79.120","TCP","54","63761  >  443 [ACK] Seq=1334 Ack=55112 Win=65792 Len=0"
"81","2.378601","27.112.79.120","192.168.43.150","TCP","1454","443  >  63761 [ACK] Seq=55112 Ack=1334 Win=5532 Len=1400 [TCP segment of a reassembled PDU]"
"82","2.378634","192.168.43.150","27.112.79.120","TCP","54","63761  >  443 [ACK] Seq=1334 Ack=56512 Win=65792 Len=0"
"83","2.378920","27.112.79.120","192.168.43.150","TCP","1454","443  >  63761 [PSH, ACK] Seq=56512 Ack=1334 Win=5532 Len=1400 [TCP segment of a reassembled PDU]"
"84","2.405362","27.112.79.120","192.168.43.150","TCP","1454","443  >  63761 [PSH, ACK] Seq=57912 Ack=1334 Win=5532 Len=1400 [TCP segment of a reassembled PDU]"
"85","2.405448","192.168.43.150","27.112.79.120","TCP","54","63761  >  443 [ACK] Seq=1334 Ack=59312 Win=65792 Len=0"
"86","2.405756","27.112.79.120","192.168.43.150","TCP","1454","443  >  63761 [ACK] Seq=59312 Ack=1334 Win=5532 Len=1400 [TCP segment of a reassembled PDU]"
"87","2.405756","27.112.79.120","192.168.43.150","TCP","1454","443  >  63761 [ACK] Seq=60712 Ack=1334 Win=5532 Len=1400 [TCP segment of a reassembled PDU]"
"88","2.405793","192.168.43.150","27.112.79.120","TCP","54","63761  >  443 [ACK] Seq=1334 Ack=62112 Win=65792 Len=0"
"89","2.406020","27.112.79.120","192.168.43.150","TCP","1454","443  >  63761 [ACK] Seq=62112 Ack=1334 Win=5532 Len=1400 [TCP segment of a reassembled PDU]"
"90","2.406352","27.112.79.120","192.168.43.150","TCP","1454","443  >  63761 [PSH, ACK] Seq=63512 Ack=1334 Win=5532 Len=1400 [TCP segment of a reassembled PDU]"
"91","2.406376","192.168.43.150","27.112.79.120","TCP","54","63761  >  443 [ACK] Seq=1334 Ack=64912 Win=65792 Len=0"
"92","2.417245","27.112.79.120","192.168.43.150","TCP","1454","443  >  63761 [PSH, ACK] Seq=64912 Ack=1334 Win=5532 Len=1400 [TCP segment of a reassembled PDU]"
"93","2.423103","27.112.79.120","192.168.43.150","TLSv1.3","1454","Application Data [TCP segment of a reassembled PDU]"
"94","2.423175","192.168.43.150","27.112.79.120","TCP","54","63761  >  443 [ACK] Seq=1334 Ack=67712 Win=65792 Len=0"
"95","2.423351","27.112.79.120","192.168.43.150","TCP","1454","443  >  63761 [ACK] Seq=67712 Ack=1334 Win=5532 Len=1400 [TCP segment of a reassembled PDU]"
"96","2.435826","27.112.79.120","192.168.43.150","TCP","1454","443  >  63761 [PSH, ACK] Seq=69112 Ack=1334 Win=5532 Len=1400 [TCP segment of a reassembled PDU]"
"97","2.435950","192.168.43.150","27.112.79.120","TCP","54","63761  >  443 [ACK] Seq=1334 Ack=70512 Win=65792 Len=0"
"98","2.436051","27.112.79.120","192.168.43.150","TCP","1454","443  >  63761 [ACK] Seq=70512 Ack=1334 Win=5532 Len=1400 [TCP segment of a reassembled PDU]"
"99","2.436288","27.112.79.120","192.168.43.150","TCP","1454","443  >  63761 [PSH, ACK] Seq=71912 Ack=1334 Win=5532 Len=1400 [TCP segment of a reassembled PDU]"
"100","2.436344","192.168.43.150","27.112.79.120","TCP","54","63761  >  443 [ACK] Seq=1334 Ack=73312 Win=65792 Len=0"
"101","2.447286","27.112.79.120","192.168.43.150","TCP","1454","443  >  63761 [PSH, ACK] Seq=73312 Ack=1334 Win=5532 Len=1400 [TCP segment of a reassembled PDU]"
"102","2.453362","27.112.79.120","192.168.43.150","TCP","1454","443  >  63761 [PSH, ACK] Seq=74712 Ack=1334 Win=5532 Len=1400 [TCP segment of a reassembled PDU]"
"103","2.453482","192.168.43.150","27.112.79.120","TCP","54","63761  >  443 [ACK] Seq=1334 Ack=76112 Win=65792 Len=0"
"104","2.453579","27.112.79.120","192.168.43.150","TCP","1454","443  >  63761 [ACK] Seq=76112 Ack=1334 Win=5532 Len=1400 [TCP segment of a reassembled PDU]"
"105","2.454626","27.112.79.120","192.168.43.150","TCP","1454","443  >  63761 [PSH, ACK] Seq=77512 Ack=1334 Win=5532 Len=1400 [TCP segment of a reassembled PDU]"
"106","2.454711","192.168.43.150","27.112.79.120","TCP","54","63761  >  443 [ACK] Seq=1334 Ack=78912 Win=65792 Len=0"
"107","2.459160","27.112.79.120","192.168.43.150","TCP","1454","443  >  63761 [PSH, ACK] Seq=78912 Ack=1334 Win=5532 Len=1400 [TCP segment of a reassembled PDU]"
"108","2.496402","27.112.79.120","192.168.43.150","TCP","1454","443  >  63761 [ACK] Seq=80312 Ack=1334 Win=5532 Len=1400 [TCP segment of a reassembled PDU]"
"109","2.496489","192.168.43.150","27.112.79.120","TCP","54","63761  >  443 [ACK] Seq=1334 Ack=81712 Win=65792 Len=0"
"110","2.508675","27.112.79.120","192.168.43.150","TLSv1.3","1454","Application Data [TCP segment of a reassembled PDU]"
"111","2.508926","27.112.79.120","192.168.43.150","TCP","1454","443  >  63761 [ACK] Seq=83112 Ack=1334 Win=5532 Len=1400 [TCP segment of a reassembled PDU]"
"112","2.508972","192.168.43.150","27.112.79.120","TCP","54","63761  >  443 [ACK] Seq=1334 Ack=84512 Win=65792 Len=0"
"113","2.514419","27.112.79.120","192.168.43.150","TCP","1454","443  >  63761 [ACK] Seq=84512 Ack=1334 Win=5532 Len=1400 [TCP segment of a reassembled PDU]"
"114","2.514419","27.112.79.120","192.168.43.150","TCP","1454","443  >  63761 [ACK] Seq=85912 Ack=1334 Win=5532 Len=1400 [TCP segment of a reassembled PDU]"
"115","2.514503","192.168.43.150","27.112.79.120","TCP","54","63761  >  443 [ACK] Seq=1334 Ack=87312 Win=65792 Len=0"
"116","2.514590","27.112.79.120","192.168.43.150","TCP","1454","443  >  63761 [ACK] Seq=87312 Ack=1334 Win=5532 Len=1400 [TCP segment of a reassembled PDU]"
"117","2.514949","27.112.79.120","192.168.43.150","TCP","1454","443  >  63761 [PSH, ACK] Seq=88712 Ack=1334 Win=5532 Len=1400 [TCP segment of a reassembled PDU]"
"118","2.515011","192.168.43.150","27.112.79.120","TCP","54","63761  >  443 [ACK] Seq=1334 Ack=90112 Win=65792 Len=0"
"119","2.515183","27.112.79.120","192.168.43.150","TCP","1454","443  >  63761 [PSH, ACK] Seq=90112 Ack=1334 Win=5532 Len=1400 [TCP segment of a reassembled PDU]"
"120","2.523176","27.112.79.120","192.168.43.150","TCP","1454","443  >  63761 [PSH, ACK] Seq=91512 Ack=1334 Win=5532 Len=1400 [TCP segment of a reassembled PDU]"
"121","2.523251","192.168.43.150","27.112.79.120","TCP","54","63761  >  443 [ACK] Seq=1334 Ack=92912 Win=65792 Len=0"
"122","2.535525","27.112.79.120","192.168.43.150","TCP","1454","443  >  63761 [PSH, ACK] Seq=92912 Ack=1334 Win=5532 Len=1400 [TCP segment of a reassembled PDU]"
"123","2.535857","27.112.79.120","192.168.43.150","TCP","1454","443  >  63761 [PSH, ACK] Seq=94312 Ack=1334 Win=5532 Len=1400 [TCP segment of a reassembled PDU]"
"124","2.535928","192.168.43.150","27.112.79.120","TCP","54","63761  >  443 [ACK] Seq=1334 Ack=95712 Win=65792 Len=0"
"125","2.550219","27.112.79.120","192.168.43.150","TCP","1454","443  >  63761 [ACK] Seq=95712 Ack=1334 Win=5532 Len=1400 [TCP segment of a reassembled PDU]"
"126","2.562339","27.112.79.120","192.168.43.150","TCP","1454","443  >  63761 [ACK] Seq=97112 Ack=1334 Win=5532 Len=1400 [TCP segment of a reassembled PDU]"
"127","2.562453","192.168.43.150","27.112.79.120","TCP","54","63761  >  443 [ACK] Seq=1334 Ack=98512 Win=65792 Len=0"
"128","2.562542","27.112.79.120","192.168.43.150","TLSv1.3","1454","Application Data [TCP segment of a reassembled PDU]"
"129","2.562862","27.112.79.120","192.168.43.150","TCP","1454","443  >  63761 [PSH, ACK] Seq=99912 Ack=1334 Win=5532 Len=1400 [TCP segment of a reassembled PDU]"
"130","2.562923","192.168.43.150","27.112.79.120","TCP","54","63761  >  443 [ACK] Seq=1334 Ack=101312 Win=65792 Len=0"
"131","2.577434","27.112.79.120","192.168.43.150","TCP","1454","443  >  63761 [ACK] Seq=101312 Ack=1334 Win=5532 Len=1400 [TCP segment of a reassembled PDU]"
"132","2.583308","27.112.79.120","192.168.43.150","TCP","1454","443  >  63761 [ACK] Seq=102712 Ack=1334 Win=5532 Len=1400 [TCP segment of a reassembled PDU]"
"133","2.583366","192.168.43.150","27.112.79.120","TCP","54","63761  >  443 [ACK] Seq=1334 Ack=104112 Win=65792 Len=0"
"134","2.595555","27.112.79.120","192.168.43.150","TCP","1454","443  >  63761 [PSH, ACK] Seq=104112 Ack=1334 Win=5532 Len=1400 [TCP segment of a reassembled PDU]"
"135","2.595799","27.112.79.120","192.168.43.150","TCP","1454","443  >  63761 [PSH, ACK] Seq=105512 Ack=1334 Win=5532 Len=1400 [TCP segment of a reassembled PDU]"
"136","2.595827","192.168.43.150","27.112.79.120","TCP","54","63761  >  443 [ACK] Seq=1334 Ack=106912 Win=65792 Len=0"
"137","2.596076","27.112.79.120","192.168.43.150","TCP","1454","443  >  63761 [PSH, ACK] Seq=106912 Ack=1334 Win=5532 Len=1400 [TCP segment of a reassembled PDU]"
"138","2.607601","27.112.79.120","192.168.43.150","TCP","1454","443  >  63761 [ACK] Seq=108312 Ack=1334 Win=5532 Len=1400 [TCP segment of a reassembled PDU]"
"139","2.607737","192.168.43.150","27.112.79.120","TCP","54","63761  >  443 [ACK] Seq=1334 Ack=109712 Win=65792 Len=0"
"140","2.613004","27.112.79.120","192.168.43.150","TCP","1454","443  >  63761 [ACK] Seq=109712 Ack=1334 Win=5532 Len=1400 [TCP segment of a reassembled PDU]"
"141","2.613258","27.112.79.120","192.168.43.150","TCP","1454","443  >  63761 [ACK] Seq=111112 Ack=1334 Win=5532 Len=1400 [TCP segment of a reassembled PDU]"
"142","2.613300","192.168.43.150","27.112.79.120","TCP","54","63761  >  443 [ACK] Seq=1334 Ack=112512 Win=65792 Len=0"
"143","2.613529","27.112.79.120","192.168.43.150","TCP","1454","443  >  63761 [PSH, ACK] Seq=112512 Ack=1334 Win=5532 Len=1400 [TCP segment of a reassembled PDU]"
"144","2.632772","27.112.79.120","192.168.43.150","TCP","1454","443  >  63761 [ACK] Seq=113912 Ack=1334 Win=5532 Len=1400 [TCP segment of a reassembled PDU]"
"145","2.633120","192.168.43.150","27.112.79.120","TCP","54","63761  >  443 [ACK] Seq=1334 Ack=115312 Win=65792 Len=0"
"146","2.638969","27.112.79.120","192.168.43.150","TLSv1.3","1454","Application Data [TCP segment of a reassembled PDU]"
"147","2.638969","27.112.79.120","192.168.43.150","TCP","1454","443  >  63761 [ACK] Seq=116712 Ack=1334 Win=5532 Len=1400 [TCP segment of a reassembled PDU]"
"148","2.639320","192.168.43.150","27.112.79.120","TCP","54","63761  >  443 [ACK] Seq=1334 Ack=118112 Win=65792 Len=0"
"149","2.639573","27.112.79.120","192.168.43.150","TCP","1454","443  >  63761 [ACK] Seq=118112 Ack=1334 Win=5532 Len=1400 [TCP segment of a reassembled PDU]"
"150","2.639721","27.112.79.120","192.168.43.150","TCP","1454","443  >  63761 [PSH, ACK] Seq=119512 Ack=1334 Win=5532 Len=1400 [TCP segment of a reassembled PDU]"
"151","2.639807","192.168.43.150","27.112.79.120","TCP","54","63761  >  443 [ACK] Seq=1334 Ack=120912 Win=65792 Len=0"
"152","2.770405","27.112.79.120","192.168.43.150","TCP","1454","443  >  63761 [PSH, ACK] Seq=120912 Ack=1334 Win=5532 Len=1400 [TCP segment of a reassembled PDU]"
"153","2.797385","27.112.79.120","192.168.43.150","TCP","1454","443  >  63761 [PSH, ACK] Seq=122312 Ack=1334 Win=5532 Len=1400 [TCP segment of a reassembled PDU]"
"154","2.797497","192.168.43.150","27.112.79.120","TCP","54","63761  >  443 [ACK] Seq=1334 Ack=123712 Win=65792 Len=0"
"155","2.853933","27.112.79.120","192.168.43.150","TCP","1454","443  >  63761 [ACK] Seq=123712 Ack=1334 Win=5532 Len=1400 [TCP segment of a reassembled PDU]"
"156","2.864931","27.112.79.120","192.168.43.150","TCP","1454","443  >  63761 [ACK] Seq=125112 Ack=1334 Win=5532 Len=1400 [TCP segment of a reassembled PDU]"
"157","2.865276","192.168.43.150","27.112.79.120","TCP","54","63761  >  443 [ACK] Seq=1334 Ack=126512 Win=65792 Len=0"
"158","2.865592","27.112.79.120","192.168.43.150","TCP","1454","443  >  63761 [ACK] Seq=126512 Ack=1334 Win=5532 Len=1400 [TCP segment of a reassembled PDU]"
"159","2.865753","27.112.79.120","192.168.43.150","TCP","1454","443  >  63761 [PSH, ACK] Seq=127912 Ack=1334 Win=5532 Len=1400 [TCP segment of a reassembled PDU]"
"160","2.865841","192.168.43.150","27.112.79.120","TCP","54","63761  >  443 [ACK] Seq=1334 Ack=129312 Win=65792 Len=0"
"161","2.865975","27.112.79.120","192.168.43.150","TCP","1454","443  >  63761 [PSH, ACK] Seq=129312 Ack=1334 Win=5532 Len=1400 [TCP segment of a reassembled PDU]"
"162","2.879913","27.112.79.120","192.168.43.150","TCP","1454","443  >  63761 [PSH, ACK] Seq=130712 Ack=1334 Win=5532 Len=1400 [TCP segment of a reassembled PDU]"
"163","2.880251","192.168.43.150","27.112.79.120","TCP","54","63761  >  443 [ACK] Seq=1334 Ack=132112 Win=65792 Len=0"
"164","2.893045","27.112.79.120","192.168.43.150","TLSv1.3","1454","Application Data [TCP segment of a reassembled PDU]"
"165","2.905162","27.112.79.120","192.168.43.150","TCP","1454","443  >  63761 [ACK] Seq=133512 Ack=1334 Win=5532 Len=1400 [TCP segment of a reassembled PDU]"
"166","2.905378","192.168.43.150","27.112.79.120","TCP","54","63761  >  443 [ACK] Seq=1334 Ack=134912 Win=65792 Len=0"
"167","2.917352","27.112.79.120","192.168.43.150","TCP","1454","443  >  63761 [PSH, ACK] Seq=134912 Ack=1334 Win=5532 Len=1400 [TCP segment of a reassembled PDU]"
"168","2.933333","27.112.79.120","192.168.43.150","TCP","1454","443  >  63761 [PSH, ACK] Seq=136312 Ack=1334 Win=5532 Len=1400 [TCP segment of a reassembled PDU]"
"169","2.933418","192.168.43.150","27.112.79.120","TCP","54","63761  >  443 [ACK] Seq=1334 Ack=137712 Win=65792 Len=0"
"170","2.944663","27.112.79.120","192.168.43.150","TCP","1454","443  >  63761 [ACK] Seq=137712 Ack=1334 Win=5532 Len=1400 [TCP segment of a reassembled PDU]"
"171","2.944912","27.112.79.120","192.168.43.150","TCP","1454","443  >  63761 [PSH, ACK] Seq=139112 Ack=1334 Win=5532 Len=1400 [TCP segment of a reassembled PDU]"
"172","2.944931","192.168.43.150","27.112.79.120","TCP","54","63761  >  443 [ACK] Seq=1334 Ack=140512 Win=65792 Len=0"
"173","2.945182","27.112.79.120","192.168.43.150","TCP","1454","443  >  63761 [PSH, ACK] Seq=140512 Ack=1334 Win=5532 Len=1400 [TCP segment of a reassembled PDU]"
"174","2.960439","27.112.79.120","192.168.43.150","TCP","1454","443  >  63761 [ACK] Seq=141912 Ack=1334 Win=5532 Len=1400 [TCP segment of a reassembled PDU]"
"175","2.960546","192.168.43.150","27.112.79.120","TCP","54","63761  >  443 [ACK] Seq=1334 Ack=143312 Win=65792 Len=0"
"176","2.972362","27.112.79.120","192.168.43.150","TCP","1454","443  >  63761 [PSH, ACK] Seq=143312 Ack=1334 Win=5532 Len=1400 [TCP segment of a reassembled PDU]"
"177","2.978363","27.112.79.120","192.168.43.150","TCP","1454","443  >  63761 [ACK] Seq=144712 Ack=1334 Win=5532 Len=1400 [TCP segment of a reassembled PDU]"
"178","2.978448","192.168.43.150","27.112.79.120","TCP","54","63761  >  443 [ACK] Seq=1334 Ack=146112 Win=65792 Len=0"
"179","2.978586","27.112.79.120","192.168.43.150","TCP","1454","443  >  63761 [PSH, ACK] Seq=146112 Ack=1334 Win=5532 Len=1400 [TCP segment of a reassembled PDU]"
"180","2.988861","27.112.79.120","192.168.43.150","TLSv1.3","1454","Application Data [TCP segment of a reassembled PDU]"
"181","2.989073","192.168.43.150","27.112.79.120","TCP","54","63761  >  443 [ACK] Seq=1334 Ack=148912 Win=65792 Len=0"
"182","3.002817","27.112.79.120","192.168.43.150","TCP","1454","443  >  63761 [ACK] Seq=148912 Ack=1334 Win=5532 Len=1400 [TCP segment of a reassembled PDU]"
"183","3.002911","27.112.79.120","192.168.43.150","TCP","1454","443  >  63761 [ACK] Seq=150312 Ack=1334 Win=5532 Len=1400 [TCP segment of a reassembled PDU]"
"184","3.002933","192.168.43.150","27.112.79.120","TCP","54","63761  >  443 [ACK] Seq=1334 Ack=151712 Win=65792 Len=0"
"185","3.007004","27.112.79.120","192.168.43.150","TCP","1454","443  >  63761 [PSH, ACK] Seq=151712 Ack=1334 Win=5532 Len=1400 [TCP segment of a reassembled PDU]"
"186","3.051721","27.112.79.120","192.168.43.150","TCP","1454","443  >  63761 [ACK] Seq=153112 Ack=1334 Win=5532 Len=1400 [TCP segment of a reassembled PDU]"
"187","3.051721","27.112.79.120","192.168.43.150","TCP","1454","443  >  63761 [ACK] Seq=154512 Ack=1334 Win=5532 Len=1400 [TCP segment of a reassembled PDU]"
"188","3.052074","192.168.43.150","27.112.79.120","TCP","54","63761  >  443 [ACK] Seq=1334 Ack=155912 Win=65792 Len=0"
"189","3.052539","27.112.79.120","192.168.43.150","TCP","1454","443  >  63761 [ACK] Seq=155912 Ack=1334 Win=5532 Len=1400 [TCP segment of a reassembled PDU]"
"190","3.052671","192.168.43.150","27.112.79.120","TCP","54","63761  >  443 [ACK] Seq=1334 Ack=157312 Win=65792 Len=0"
"191","3.052854","27.112.79.120","192.168.43.150","TCP","1454","443  >  63761 [PSH, ACK] Seq=157312 Ack=1334 Win=5532 Len=1400 [TCP segment of a reassembled PDU]"
"192","3.052999","27.112.79.120","192.168.43.150","TCP","1454","443  >  63761 [PSH, ACK] Seq=158712 Ack=1334 Win=5532 Len=1400 [TCP segment of a reassembled PDU]"
"193","3.053100","192.168.43.150","27.112.79.120","TCP","54","63761  >  443 [ACK] Seq=1334 Ack=160112 Win=65792 Len=0"
"194","3.074450","27.112.79.120","192.168.43.150","TCP","1454","443  >  63761 [ACK] Seq=160112 Ack=1334 Win=5532 Len=1400 [TCP segment of a reassembled PDU]"
"195","3.086985","27.112.79.120","192.168.43.150","TCP","1454","443  >  63761 [ACK] Seq=161512 Ack=1334 Win=5532 Len=1400 [TCP segment of a reassembled PDU]"
"196","3.086985","27.112.79.120","192.168.43.150","TCP","1454","443  >  63761 [ACK] Seq=162912 Ack=1334 Win=5532 Len=1400 [TCP segment of a reassembled PDU]"
"197","3.087375","192.168.43.150","27.112.79.120","TCP","54","63761  >  443 [ACK] Seq=1334 Ack=164312 Win=65792 Len=0"
"198","3.087645","27.112.79.120","192.168.43.150","TLSv1.3","1454","Application Data [TCP segment of a reassembled PDU]"
"199","3.087768","192.168.43.150","27.112.79.120","TCP","54","63761  >  443 [ACK] Seq=1334 Ack=165712 Win=65792 Len=0"
"200","3.087905","27.112.79.120","192.168.43.150","TCP","1454","443  >  63761 [ACK] Seq=165712 Ack=1334 Win=5532 Len=1400 [TCP segment of a reassembled PDU]"
"201","3.088068","27.112.79.120","192.168.43.150","TCP","1454","443  >  63761 [ACK] Seq=167112 Ack=1334 Win=5532 Len=1400 [TCP segment of a reassembled PDU]"
"202","3.088185","192.168.43.150","27.112.79.120","TCP","54","63761  >  443 [ACK] Seq=1334 Ack=168512 Win=65792 Len=0"
"203","3.096798","27.112.79.120","192.168.43.150","TCP","1454","443  >  63761 [PSH, ACK] Seq=168512 Ack=1334 Win=5532 Len=1400 [TCP segment of a reassembled PDU]"
"204","3.098278","27.112.79.120","192.168.43.150","TCP","1454","443  >  63761 [PSH, ACK] Seq=169912 Ack=1334 Win=5532 Len=1400 [TCP segment of a reassembled PDU]"
"205","3.098430","192.168.43.150","27.112.79.120","TCP","54","63761  >  443 [ACK] Seq=1334 Ack=171312 Win=65792 Len=0"
"206","3.104441","27.112.79.120","192.168.43.150","TCP","1454","443  >  63761 [ACK] Seq=171312 Ack=1334 Win=5532 Len=1400 [TCP segment of a reassembled PDU]"
"207","3.110569","27.112.79.120","192.168.43.150","TCP","1454","443  >  63761 [PSH, ACK] Seq=172712 Ack=1334 Win=5532 Len=1400 [TCP segment of a reassembled PDU]"
"208","3.110925","192.168.43.150","27.112.79.120","TCP","54","63761  >  443 [ACK] Seq=1334 Ack=174112 Win=65792 Len=0"
"209","3.137095","27.112.79.120","192.168.43.150","TCP","1454","443  >  63761 [ACK] Seq=174112 Ack=1334 Win=5532 Len=1400 [TCP segment of a reassembled PDU]"
"210","3.140715","27.112.79.120","192.168.43.150","TCP","1454","443  >  63761 [ACK] Seq=175512 Ack=1334 Win=5532 Len=1400 [TCP segment of a reassembled PDU]"
"211","3.141075","192.168.43.150","27.112.79.120","TCP","54","63761  >  443 [ACK] Seq=1334 Ack=176912 Win=65792 Len=0"
"212","3.141363","27.112.79.120","192.168.43.150","TCP","1454","443  >  63761 [PSH, ACK] Seq=176912 Ack=1334 Win=5532 Len=1400 [TCP segment of a reassembled PDU]"
"213","3.141594","27.112.79.120","192.168.43.150","TCP","1454","443  >  63761 [ACK] Seq=178312 Ack=1334 Win=5532 Len=1400 [TCP segment of a reassembled PDU]"
"214","3.141694","192.168.43.150","27.112.79.120","TCP","54","63761  >  443 [ACK] Seq=1334 Ack=179712 Win=65792 Len=0"
"215","3.141858","27.112.79.120","192.168.43.150","TCP","1454","443  >  63761 [PSH, ACK] Seq=179712 Ack=1334 Win=5532 Len=1400 [TCP segment of a reassembled PDU]"
"216","3.184007","192.168.43.150","27.112.79.120","TCP","54","63761  >  443 [ACK] Seq=1334 Ack=181112 Win=65792 Len=0"
"217","3.199396","27.112.79.120","192.168.43.150","TLSv1.3","1454","Application Data [TCP segment of a reassembled PDU]"
"218","3.211591","27.112.79.120","192.168.43.150","TCP","1454","443  >  63761 [PSH, ACK] Seq=182512 Ack=1334 Win=5532 Len=1400 [TCP segment of a reassembled PDU]"
"219","3.211701","192.168.43.150","27.112.79.120","TCP","54","63761  >  443 [ACK] Seq=1334 Ack=183912 Win=65792 Len=0"
"220","3.269195","27.112.79.120","192.168.43.150","TCP","1454","443  >  63761 [PSH, ACK] Seq=183912 Ack=1334 Win=5532 Len=1400 [TCP segment of a reassembled PDU]"
"221","3.302188","27.112.79.120","192.168.43.150","TCP","1454","443  >  63761 [ACK] Seq=185312 Ack=1334 Win=5532 Len=1400 [TCP segment of a reassembled PDU]"
"222","3.302345","192.168.43.150","27.112.79.120","TCP","54","63761  >  443 [ACK] Seq=1334 Ack=186712 Win=65792 Len=0"
"223","3.313468","27.112.79.120","192.168.43.150","TCP","1454","443  >  63761 [ACK] Seq=186712 Ack=1334 Win=5532 Len=1400 [TCP segment of a reassembled PDU]"
"224","3.313468","27.112.79.120","192.168.43.150","TCP","1454","443  >  63761 [ACK] Seq=188112 Ack=1334 Win=5532 Len=1400 [TCP segment of a reassembled PDU]"
"225","3.313580","192.168.43.150","27.112.79.120","TCP","54","63761  >  443 [ACK] Seq=1334 Ack=189512 Win=65792 Len=0"
"226","3.313672","27.112.79.120","192.168.43.150","TCP","1454","443  >  63761 [PSH, ACK] Seq=189512 Ack=1334 Win=5532 Len=1400 [TCP segment of a reassembled PDU]"
"227","3.313952","27.112.79.120","192.168.43.150","TCP","1454","443  >  63761 [PSH, ACK] Seq=190912 Ack=1334 Win=5532 Len=1400 [TCP segment of a reassembled PDU]"
"228","3.314012","192.168.43.150","27.112.79.120","TCP","54","63761  >  443 [ACK] Seq=1334 Ack=192312 Win=65792 Len=0"
"229","3.321431","27.112.79.120","192.168.43.150","TCP","1454","443  >  63761 [ACK] Seq=192312 Ack=1334 Win=5532 Len=1400 [TCP segment of a reassembled PDU]"
"230","3.333624","27.112.79.120","192.168.43.150","TCP","1454","443  >  63761 [PSH, ACK] Seq=193712 Ack=1334 Win=5532 Len=1400 [TCP segment of a reassembled PDU]"
"231","3.333985","192.168.43.150","27.112.79.120","TCP","54","63761  >  443 [ACK] Seq=1334 Ack=195112 Win=65792 Len=0"
"232","3.351410","27.112.79.120","192.168.43.150","TCP","1454","443  >  63761 [ACK] Seq=195112 Ack=1334 Win=5532 Len=1400 [TCP segment of a reassembled PDU]"
"233","3.364003","27.112.79.120","192.168.43.150","TLSv1.3","1454","Application Data [TCP segment of a reassembled PDU]"
"234","3.364327","192.168.43.150","27.112.79.120","TCP","54","63761  >  443 [ACK] Seq=1334 Ack=197912 Win=65792 Len=0"
"235","3.364575","27.112.79.120","192.168.43.150","TCP","1454","443  >  63761 [ACK] Seq=197912 Ack=1334 Win=5532 Len=1400 [TCP segment of a reassembled PDU]"
"236","3.364707","27.112.79.120","192.168.43.150","TCP","1454","443  >  63761 [PSH, ACK] Seq=199312 Ack=1334 Win=5532 Len=1400 [TCP segment of a reassembled PDU]"
"237","3.364813","192.168.43.150","27.112.79.120","TCP","54","63761  >  443 [ACK] Seq=1334 Ack=200712 Win=65792 Len=0"
"238","3.395754","27.112.79.120","192.168.43.150","TCP","1454","443  >  63761 [PSH, ACK] Seq=200712 Ack=1334 Win=5532 Len=1400 [TCP segment of a reassembled PDU]"
"239","3.435978","192.168.43.150","27.112.79.120","TCP","54","63761  >  443 [ACK] Seq=1334 Ack=202112 Win=65792 Len=0"
"240","3.548738","27.112.79.120","192.168.43.150","TCP","1454","443  >  63761 [ACK] Seq=202112 Ack=1334 Win=5532 Len=1400 [TCP segment of a reassembled PDU]"
"241","3.560898","27.112.79.120","192.168.43.150","TCP","1454","443  >  63761 [PSH, ACK] Seq=203512 Ack=1334 Win=5532 Len=1400 [TCP segment of a reassembled PDU]"
"242","3.561231","192.168.43.150","27.112.79.120","TCP","54","63761  >  443 [ACK] Seq=1334 Ack=204912 Win=65792 Len=0"
"243","3.995414","27.112.79.120","192.168.43.150","TCP","1454","443  >  63761 [ACK] Seq=204912 Ack=1334 Win=5532 Len=1400 [TCP segment of a reassembled PDU]"
"244","4.007358","27.112.79.120","192.168.43.150","TCP","1454","443  >  63761 [ACK] Seq=206312 Ack=1334 Win=5532 Len=1400 [TCP segment of a reassembled PDU]"
"245","4.007447","192.168.43.150","27.112.79.120","TCP","54","63761  >  443 [ACK] Seq=1334 Ack=207712 Win=65792 Len=0"
"246","4.007539","27.112.79.120","192.168.43.150","TCP","1454","443  >  63761 [PSH, ACK] Seq=207712 Ack=1334 Win=5532 Len=1400 [TCP segment of a reassembled PDU]"
"247","4.007855","27.112.79.120","192.168.43.150","TCP","1454","443  >  63761 [PSH, ACK] Seq=209112 Ack=1334 Win=5532 Len=1400 [TCP segment of a reassembled PDU]"
"248","4.007878","192.168.43.150","27.112.79.120","TCP","54","63761  >  443 [ACK] Seq=1334 Ack=210512 Win=65792 Len=0"
"249","4.008126","27.112.79.120","192.168.43.150","TCP","1454","443  >  63761 [PSH, ACK] Seq=210512 Ack=1334 Win=5532 Len=1400 [TCP segment of a reassembled PDU]"
"250","4.008398","27.112.79.120","192.168.43.150","TCP","1454","443  >  63761 [PSH, ACK] Seq=211912 Ack=1334 Win=5532 Len=1400 [TCP segment of a reassembled PDU]"
"251","4.008421","192.168.43.150","27.112.79.120","TCP","54","63761  >  443 [ACK] Seq=1334 Ack=213312 Win=65792 Len=0"
"252","4.012509","27.112.79.120","192.168.43.150","TLSv1.3","1454","Application Data [TCP segment of a reassembled PDU]"
"253","4.013214","27.112.79.120","192.168.43.150","TCP","1454","443  >  63761 [PSH, ACK] Seq=214712 Ack=1334 Win=5532 Len=1400 [TCP segment of a reassembled PDU]"
"254","4.013214","27.112.79.120","192.168.43.150","TCP","1454","443  >  63761 [PSH, ACK] Seq=216112 Ack=1334 Win=5532 Len=1400 [TCP segment of a reassembled PDU]"
"255","4.013292","192.168.43.150","27.112.79.120","TCP","54","63761  >  443 [ACK] Seq=1334 Ack=217512 Win=65792 Len=0"
"256","4.013368","27.112.79.120","192.168.43.150","TCP","1454","443  >  63761 [ACK] Seq=217512 Ack=1334 Win=5532 Len=1400 [TCP segment of a reassembled PDU]"
"257","4.013408","192.168.43.150","27.112.79.120","TCP","54","63761  >  443 [ACK] Seq=1334 Ack=218912 Win=65792 Len=0"
"258","4.013463","27.112.79.120","192.168.43.150","TCP","1454","443  >  63761 [ACK] Seq=218912 Ack=1334 Win=5532 Len=1400 [TCP segment of a reassembled PDU]"
"259","4.013790","27.112.79.120","192.168.43.150","TCP","1454","443  >  63761 [ACK] Seq=220312 Ack=1334 Win=5532 Len=1400 [TCP segment of a reassembled PDU]"
"260","4.013846","192.168.43.150","27.112.79.120","TCP","54","63761  >  443 [ACK] Seq=1334 Ack=221712 Win=65792 Len=0"
"261","4.018257","27.112.79.120","192.168.43.150","TCP","1454","443  >  63761 [PSH, ACK] Seq=221712 Ack=1334 Win=5532 Len=1400 [TCP segment of a reassembled PDU]"
"262","4.018361","27.112.79.120","192.168.43.150","TCP","1454","443  >  63761 [ACK] Seq=223112 Ack=1334 Win=5532 Len=1400 [TCP segment of a reassembled PDU]"
"263","4.018395","192.168.43.150","27.112.79.120","TCP","54","63761  >  443 [ACK] Seq=1334 Ack=224512 Win=65792 Len=0"
"264","4.018676","27.112.79.120","192.168.43.150","TCP","1454","443  >  63761 [ACK] Seq=224512 Ack=1334 Win=5532 Len=1400 [TCP segment of a reassembled PDU]"
"265","4.019034","27.112.79.120","192.168.43.150","TCP","1454","443  >  63761 [PSH, ACK] Seq=225912 Ack=1334 Win=5532 Len=1400 [TCP segment of a reassembled PDU]"
"266","4.019078","192.168.43.150","27.112.79.120","TCP","54","63761  >  443 [ACK] Seq=1334 Ack=227312 Win=65792 Len=0"
"267","4.031463","27.112.79.120","192.168.43.150","TCP","1454","443  >  63761 [ACK] Seq=227312 Ack=1334 Win=5532 Len=1400 [TCP segment of a reassembled PDU]"
"268","4.043902","27.112.79.120","192.168.43.150","TCP","1454","443  >  63761 [PSH, ACK] Seq=228712 Ack=1334 Win=5532 Len=1400 [TCP segment of a reassembled PDU]"
"269","4.044231","192.168.43.150","27.112.79.120","TCP","54","63761  >  443 [ACK] Seq=1334 Ack=230112 Win=65792 Len=0"
"270","4.058199","27.112.79.120","192.168.43.150","TLSv1.3","1454","Application Data [TCP segment of a reassembled PDU]"
"271","4.075848","27.112.79.120","192.168.43.150","TCP","1454","443  >  63761 [PSH, ACK] Seq=231512 Ack=1334 Win=5532 Len=1400 [TCP segment of a reassembled PDU]"
"272","4.076199","192.168.43.150","27.112.79.120","TCP","54","63761  >  443 [ACK] Seq=1334 Ack=232912 Win=65792 Len=0"
"273","4.087794","27.112.79.120","192.168.43.150","TCP","1454","443  >  63761 [ACK] Seq=232912 Ack=1334 Win=5532 Len=1400 [TCP segment of a reassembled PDU]"
"274","4.093596","27.112.79.120","192.168.43.150","TCP","1454","443  >  63761 [ACK] Seq=234312 Ack=1334 Win=5532 Len=1400 [TCP segment of a reassembled PDU]"
"275","4.094018","192.168.43.150","27.112.79.120","TCP","54","63761  >  443 [ACK] Seq=1334 Ack=235712 Win=65792 Len=0"
"276","4.094331","27.112.79.120","192.168.43.150","TCP","1454","443  >  63761 [PSH, ACK] Seq=235712 Ack=1334 Win=5532 Len=1400 [TCP segment of a reassembled PDU]"
"277","4.138538","192.168.43.150","27.112.79.120","TCP","54","63761  >  443 [ACK] Seq=1334 Ack=237112 Win=65792 Len=0"
"279","4.614942","27.112.79.120","192.168.43.150","TCP","1454","443  >  63761 [PSH, ACK] Seq=237112 Ack=1334 Win=5532 Len=1400 [TCP segment of a reassembled PDU]"
"280","4.623769","27.112.79.120","192.168.43.150","TCP","1454","443  >  63761 [PSH, ACK] Seq=238512 Ack=1334 Win=5532 Len=1400 [TCP segment of a reassembled PDU]"
"281","4.624120","192.168.43.150","27.112.79.120","TCP","54","63761  >  443 [ACK] Seq=1334 Ack=239912 Win=65792 Len=0"
"282","4.624430","27.112.79.120","192.168.43.150","TCP","1454","443  >  63761 [ACK] Seq=239912 Ack=1334 Win=5532 Len=1400 [TCP segment of a reassembled PDU]"
"283","4.624573","27.112.79.120","192.168.43.150","TCP","1454","443  >  63761 [PSH, ACK] Seq=241312 Ack=1334 Win=5532 Len=1400 [TCP segment of a reassembled PDU]"
"284","4.624667","192.168.43.150","27.112.79.120","TCP","54","63761  >  443 [ACK] Seq=1334 Ack=242712 Win=65792 Len=0"
"286","4.643775","27.112.79.120","192.168.43.150","TCP","1454","443  >  63761 [PSH, ACK] Seq=242712 Ack=1334 Win=5532 Len=1400 [TCP segment of a reassembled PDU]"
"287","4.644225","27.112.79.120","192.168.43.150","TCP","1454","443  >  63761 [PSH, ACK] Seq=244112 Ack=1334 Win=5532 Len=1400 [TCP segment of a reassembled PDU]"
"288","4.644350","192.168.43.150","27.112.79.120","TCP","54","63761  >  443 [ACK] Seq=1334 Ack=245512 Win=65792 Len=0"
"289","4.645004","27.112.79.120","192.168.43.150","TCP","1454","443  >  63761 [PSH, ACK] Seq=245512 Ack=1334 Win=5532 Len=1400 [TCP segment of a reassembled PDU]"
"290","4.645004","27.112.79.120","192.168.43.150","TLSv1.3","1454","Application Data [TCP segment of a reassembled PDU]"
"291","4.645004","27.112.79.120","192.168.43.150","TCP","1454","443  >  63761 [ACK] Seq=248312 Ack=1334 Win=5532 Len=1400 [TCP segment of a reassembled PDU]"
